{
  "schema_version": "1.0",
  "status": "verified",
  "verified_at": "2026-09-10T16:10:18-07:00",
  "verification_scope": "Exact model IDs, interfaces, authentication transports, documented parameter constraints, regions, and token prices were checked against official provider documentation before collection.",
  "arms": [
    {
      "role": "primary",
      "config": "configs/providers/anthropic-claude-sonnet-5.json",
      "config_sha256": "67b61b1ff18dce6181bccb8c95a9eb4fe252dbf659333925268005c145c17ed3",
      "provider": "anthropic",
      "model": "claude-sonnet-5",
      "region": "us-east-1",
      "provider_type": "aws_bedrock_anthropic_messages",
      "pricing_usd_per_million_tokens": {
        "input": 3.0,
        "cached_input": 0.3,
        "output": 15.0
      },
      "documented_pricing_usd_per_million_tokens": {
        "input": 3.0,
        "cached_input": 0.3,
        "output": 15.0
      },
      "reservation_pricing_policy": "documented-current-rate",
      "parameter_constraints": {
        "temperature": "unset",
        "thinking": "adaptive-default"
      },
      "sources": [
        {
          "url": "https://platform.claude.com/docs/en/about-claude/models/whats-new-sonnet-5",
          "claims": [
            "Exact API model ID is claude-sonnet-5.",
            "Sonnet 5 uses adaptive thinking and rejects non-default temperature, top_p, and top_k."
          ]
        },
        {
          "url": "https://platform.claude.com/docs/en/about-claude/pricing",
          "claims": [
            "Standard input price is $3 per million tokens.",
            "Standard cache-read input price is $0.30 per million tokens.",
            "Standard output price is $15 per million tokens."
          ]
        },
        {
          "url": "https://platform.claude.com/docs/en/about-claude/models/migration-guide",
          "claims": [
            "The migration guide contains an August 31, 2026 transition notice to $3 input and $15 output per million tokens.",
            "The experiment runs after the transition and therefore reserves at the standard rate."
          ]
        },
        {
          "url": "https://docs.aws.amazon.com/bedrock/latest/userguide/model-card-anthropic-claude-sonnet-5.html",
          "claims": [
            "Amazon Bedrock exposes the exact Anthropic Claude Sonnet 5 model.",
            "The US geographic inference profile is us.anthropic.claude-sonnet-5.",
            "The model supports native Bedrock runtime invocation and is billed through AWS Marketplace."
          ]
        },
        {
          "url": "https://docs.aws.amazon.com/bedrock/latest/userguide/model-parameters-anthropic-claude-messages.html",
          "claims": [
            "Native InvokeModel requests use the Anthropic Messages schema.",
            "The request body uses anthropic_version bedrock-2023-05-31."
          ]
        }
      ]
    },
    {
      "role": "primary",
      "config": "configs/providers/nvidia-nemotron-3-super-bedrock.json",
      "config_sha256": "03a11a954c572971cf07af4c5e582067a89e6d60241790df0f98bee94561229c",
      "provider": "nvidia-bedrock",
      "model": "nvidia.nemotron-super-3-120b",
      "region": "us-east-1",
      "provider_type": "aws_bedrock_invoke_model",
      "pricing_usd_per_million_tokens": {
        "input": 0.15,
        "cached_input": 0.15,
        "output": 0.65
      },
      "documented_pricing_usd_per_million_tokens": {
        "input": 0.15,
        "cached_input": 0.15,
        "output": 0.65
      },
      "reservation_pricing_policy": "documented-current-rate",
      "parameter_constraints": {
        "cached_input_pricing": "conservative-equal-to-input",
        "temperature": "0.2"
      },
      "sources": [
        {
          "url": "https://docs.aws.amazon.com/bedrock/latest/userguide/model-card-nvidia-nemotron-super-3-120b.html",
          "claims": [
            "Exact Bedrock model ID is nvidia.nemotron-super-3-120b.",
            "The model supports native Bedrock InvokeModel requests with the chat-completions message schema.",
            "The model is available in us-east-1."
          ]
        },
        {
          "url": "https://aws.amazon.com/bedrock/pricing/",
          "claims": [
            "Input price is $0.15 per million tokens.",
            "Output price is $0.65 per million tokens.",
            "No lower cache-read price is advertised, so the config conservatively uses the ordinary input price."
          ]
        },
        {
          "url": "https://docs.aws.amazon.com/cli/latest/reference/bedrock-runtime/invoke-model.html",
          "claims": [
            "The AWS CLI exposes bedrock-runtime invoke-model.",
            "AWS profile credentials are SigV4-signed without storing a bearer API key in the benchmark."
          ]
        }
      ]
    },
    {
      "role": "primary",
      "config": "configs/providers/openai-gpt-5.6-terra.json",
      "config_sha256": "211805028bfd3132e85fad07741e8fdec05d4a796a37bcc0804c36a849983ce7",
      "provider": "openai",
      "model": "us.openai.gpt-5.6-terra",
      "region": "us-east-1",
      "provider_type": "aws_bedrock_openai_responses",
      "pricing_usd_per_million_tokens": {
        "input": 2.2,
        "cached_input": 0.22,
        "output": 13.2
      },
      "documented_pricing_usd_per_million_tokens": {
        "input": 2.2,
        "cached_input": 0.22,
        "output": 13.2
      },
      "reservation_pricing_policy": "documented-current-rate",
      "parameter_constraints": {
        "reasoning_effort": "none",
        "temperature": "unset"
      },
      "sources": [
        {
          "url": "https://developers.openai.com/api/docs/models/gpt-5.6-terra",
          "claims": [
            "The underlying model is GPT-5.6 Terra.",
            "The model supports the Responses API and reasoning effort none."
          ]
        },
        {
          "url": "https://docs.aws.amazon.com/bedrock/latest/userguide/model-card-openai-gpt-oss-56.html",
          "claims": [
            "Amazon Bedrock exposes GPT-5.6 Terra through the us.openai.gpt-5.6-terra US geographic inference profile.",
            "The OpenAI-compatible Responses endpoint accepts AWS Signature Version 4 authentication.",
            "US geographic routing prices are $2.20 input, $0.22 cached input, and $13.20 output per million tokens."
          ]
        }
      ]
    },
    {
      "role": "judge",
      "config": "configs/judges/openai-gpt-5.4-mini.json",
      "config_sha256": "166f3e7b4b1d261c413281f0604b02a4aa1ce27d26e04813d965e1142ea20272",
      "provider": "openai-judge",
      "model": "gpt-5.4-mini",
      "region": null,
      "provider_type": "openai_responses",
      "pricing_usd_per_million_tokens": {
        "input": 0.75,
        "cached_input": 0.075,
        "output": 4.5
      },
      "documented_pricing_usd_per_million_tokens": {
        "input": 0.75,
        "cached_input": 0.075,
        "output": 4.5
      },
      "reservation_pricing_policy": "documented-current-rate",
      "parameter_constraints": {
        "reasoning_effort": "none",
        "temperature": "unset"
      },
      "sources": [
        {
          "url": "https://developers.openai.com/api/docs/models/gpt-5.4-mini",
          "claims": [
            "Exact model ID is gpt-5.4-mini.",
            "The model supports the Responses API and reasoning effort none.",
            "Input, cached-input, and output prices are $0.75, $0.075, and $4.50 per million tokens."
          ]
        }
      ]
    }
  ]
}
